{
  "guild": {
    "id": "123456789012345678",
    "name": "OpenClaw Ops"
  },
  "discord": {
    "mode": "mock",
    "tokenEnvVar": "DISCORD_BOT_TOKEN",
    "dryRun": true,
    "allowCreate": false,
    "testServerOnly": true,
    "maxOpsPerRun": 5,
    "requestDelayMs": 750
  },
  "board": {
    "key": "openclaw-discord-status",
    "baseName": "OPENCLAW",
    "managedCategoryId": "998877665544332211",
    "sortOffset": 10,
    "maxNameLength": 60,
    "channels": [
      {
        "id": "998877665544332212",
        "key": "connection",
        "label": "Connection",
        "stateBinding": "connection",
        "template": "connection-{value}",
        "position": 0
      },
      {
        "id": "998877665544332213",
        "key": "activity",
        "label": "Activity",
        "stateBinding": "activity",
        "template": "activity-{value}",
        "position": 1
      },
      {
        "id": "998877665544332214",
        "key": "task",
        "label": "Current Task",
        "stateBinding": "task.current",
        "template": "task-{value}",
        "position": 2
      },
      {
        "id": "998877665544332215",
        "key": "phase",
        "label": "Phase",
        "stateBinding": "task.phase",
        "template": "phase-{value}",
        "position": 3
      },
      {
        "id": "998877665544332216",
        "key": "heartbeat",
        "label": "Heartbeat Age",
        "stateBinding": "heartbeat.age",
        "template": "heartbeat-{value}",
        "position": 4
      },
      {
        "id": "998877665544332217",
        "key": "pending",
        "label": "Pending Queue",
        "stateBinding": "queue.pending",
        "template": "queue-{value}-active",
        "position": 5
      },
      {
        "id": "998877665544332218",
        "key": "backlog",
        "label": "Backlog",
        "stateBinding": "queue.backlog",
        "template": "backlog-{value}",
        "position": 6
      },
      {
        "id": "998877665544332219",
        "key": "blockers",
        "label": "Blockers",
        "stateBinding": "blockers.summary",
        "template": "blockers-{value}",
        "position": 7
      }
    ]
  },
  "runtime": {
    "bot": {
      "presence": "busy",
      "connection": "connected",
      "activity": "discord-ops"
    },
    "task": {
      "current": "specializing-status-tracker",
      "phase": "editing-runtime-model"
    },
    "heartbeat": {
      "lastSeen": "2026-03-25T17:20:00Z"
    },
    "queue": {
      "pending": 2,
      "backlog": 5
    },
    "blockers": [
      {
        "code": "awaiting-live-discord-adapter",
        "summary": "Need real Discord API integration"
      }
    ]
  }
}
